region code,id,title,category,views,comments,duration
CA,FALlhXl6CmA,Conan O'Brien Needs a Doctor While Eating Spicy Wings | Hot Ones,Entertainment,2427482,23463,27m 21s
CA,U4JYAx5rNRA,Bridgerton Season 3 | Official Trailer | Netflix,Entertainment,2735690,5379,2m 48s
CA,a9cyG_yfh1k,Dua Lipa - Illusion (Official Music Video),Music,1688286,10403,3m 7s
CA,7D0wFf4GqLI,Coming Soon: New Pokémon GO Updates,Gaming,396896,1631,0m 15s
CA,xy8aJw1vYHo,Joker: Folie à Deux | Official Teaser Trailer,Film & Animation,20014946,31243,2m 25s
CA,oQkQv1ULyzs,"Kendall Jenner’s Guide to “Spring French Girl"" Makeup | Beauty Secrets | Vogue",Entertainment,652189,989,11m 27s
CA,BlUxw-0lS94,Season 10: Venture Forth | Overwatch 2 Official Trailer,Gaming,479445,3209,2m 25s
CA,FpOzMBwjSK0,[4K] BABYMONSTER “SHEESH” Band LIVE Concert 세상을 SHEESH하게 만들 베몬 밴드라이브😈 [it’s KPOP LIVE 잇츠라이브],Entertainment,3235454,21266,5m 25s
CA,TjVXrw80MfU,I Built The Most Over The Top End Portal In Minecraft Hardcore,Gaming,424235,2387,19m 24s
CA,S8aKWCxiLps,Fortnite x Avatar: Elements - Gameplay Trailer,Gaming,569745,2055,0m 51s
CA,4ZCnIOI7zLw,2024 Honorary Starters at the Masters,Sports,306364,355,6m 11s
CA,DJN7Jr4FPeA,'HOT DEBUT' BABYMONSTER - SHEESH #엠카운트다운 EP.837 | Mnet 240411 방송,Gaming,2231898,6016,4m 58s
CA,j6ucGt_Xp14,Dark Matter — Official Trailer | Apple TV+,Entertainment,1428302,840,2m 52s
CA,u4VwzWu4P8I,Laufey - Goddess (Official Music Video),Music,261264,2254,4m 50s
CA,YQfC90O9HlI,I Built an Invisible Katana (it's indestructible),Entertainment,1155628,2369,22m 2s
CA,yHSPofOIGOU,Pawn Stars: These Sellers Are Offered WAY MORE Than Expected,Entertainment,902459,979,20m 25s
CA,c2G18nIVpNE,Civil War | Official Final Trailer HD | A24,Film & Animation,4879036,1182,1m 1s
CA,FjzxI6uf8H8,Speak No Evil | Official Trailer,Entertainment,4924653,1444,2m 56s
CA,1te6zsiN2gM,"Heart Reveal How Their Famous ""Stairway to Heaven"" Performance Happened",Entertainment,296290,160,3m 37s
CA,9B9eR0IOK18,Kodak Black - Stressed Out [Official Music Video],Music,814742,6255,4m 14s
CA,oSca__bu0is,NLE Choppa - SLUT ME OUT 2 (Official Music Video),Music,80671,1243,2m 26s
CA,JyYQmekPqqI,We made a real DOGDAY Animatronic!,Howto & Style,827903,5011,27m 55s
CA,frM1_rmltU8,"The 8K Era Is Here - Our Next Camera, April 16",Science & Technology,137080,6943,0m 38s
CA,e069XIFk9K4,Everything is gone...,Autos & Vehicles,504371,4511,17m 50s
CA,rQovYh9lMBY,Gil's Arena GETS HONEST About Bronny's NBA Chances,Sports,378017,2681,17m 18s
CA,dprcKCAmsTI,IT'S WEDDING WEEKEND!!! The Rehearsal & Welcome Party!!,People & Blogs,139315,396,23m 50s
CA,aVKXPYisye8,"Simon Says survive to win 10,000 v-bucks!",Gaming,661600,790,24m 43s
CA,bv-kwQTU-m8,Monterrey vs. Inter Miami CF Highlights | FOX Soccer,Sports,339217,1932,4m 55s
CA,kIcZiVNC-sE,The 2025 Toyota 4Runner is HERE! First look,People & Blogs,375947,1012,11m 13s
CA,kmtbk0siRIM,2025 Toyota 4Runner FULL Tour: It's Finally Here!,Autos & Vehicles,906055,3585,27m 49s
CA,SrlwvbAMEA0,DThang - Many Opps ( official music video ),People & Blogs,230000,1365,2m 42s
CA,tcdKEy-aJ6o,Star Wars Outlaws: Official Story Trailer,Gaming,1584992,11696,2m 46s
CA,crGbURdPRsc,We Played a YouTuber Simulator,Gaming,1374917,1436,23m 51s
CA,ymm4Ej0ocBw,2025 Toyota 4Runner Reveal & Overview | Toyota,Autos & Vehicles,341666,1083,8m 42s
CA,amHIb5BL6gE,I Cheated With SCARY CAMERA In Build Battle...,Gaming,358989,286,23m 46s
CA,6VChofV3d0E,Helldivers 2 Review | TRIPLE THE DEFENSE BUDGET | Starship Bloopers,Gaming,983247,3426,15m 15s
CA,o9Z0gK-QiJc,JOJO SIWA: The Woman Behind The Bow,Entertainment,165760,468,6m 29s
CA,fPAeRGBDrBM,DRIVING MARCUS RASHFORDS WRECKED ROLLS ROYCE FOR THE FIRST TIME,Autos & Vehicles,3213496,5138,36m 9s
CA,xamGwv3zPCU,"Julian Newman, D’Aydrian, Paul Pierce vs Josh Richards, Cash Nasty, Demarcus Cousins!",Sports,156275,770,16m 55s
CA,fampr-iP_y4,Final Shape: Prismatic Subclasses. 2 Exotics at once. New enemy types. They actually cooked.,Gaming,259671,1168,20m 51s
CA,yvB5gQVyVtI,Detailed Look! All New 2025 6th Gen Toyota 4Runner TRD Pro!,Autos & Vehicles,124916,808,14m 31s
CA,F_HOrMmWoMA,"The ""Artificial Intelligence"" Rice Cooker.",Science & Technology,312781,1681,9m 12s
CA,3qSm4fmEQFA,ASMR Scratching Your Back Until You Sleep,Entertainment,251134,583,26m 7s
CA,Snz_0-NC_Bo,Surprising Zach With a Giant Shrek Cake,Comedy,441493,1203,21m 9s
CA,8xhehywx29k,J. Cole Apologized,Music,457821,3578,8m 45s
CA,KUT2IstU7Ig,Gift Swap Challenge at Five Below! - Merrell Twins,Comedy,193014,391,22m 3s
CA,UJHejXUP4io,I Played My FIRST EVER Professional Game! (Project NFL Ep. 8),Entertainment,1061399,1711,18m 12s
CA,8f-S01gjqI8,Transformers: The Last Knight - Cosmonaut Picture Show,Entertainment,362689,1541,34m 51s
CA,CToHJvXEO_A,Something Needs to Change… my first week living at home,People & Blogs,313390,2439,38m 11s
CA,VhS3ju_oLOk,Giannis Grabs Achilles and Limps Off After Non Contact Injury - Doctor Explains,Sports,167294,532,7m 30s
